<?xml version="1.0" encoding="UTF-8"?><student xmlns:xsi="http://www.w3.org/2001/XMLSchema-instance" xsi:noNamespaceSchemaLocation="StudentInfo.xsd">  <studentId>123</studentId>  <firtName>test first name</firtName>  <lastName>test last name</lastName><dateOfBirth>22/2/2026</dateOfBirth><studentEmail>abc@gmail.com</studentEmail><guardianContactName>test Parent</guardianContactName><guardianContactNo>1212phoneno</guardianContactNo></student>